{
    "id": "example_complex_001",
    "version": 1,
    "metadata": {
        "question_text": "Who has the right of way?",
        "difficulty": 3,
        "tags": [
            "intersection",
            "precedence"
        ]
    },
    "blocks": [
        {
            "id": "block_visual",
            "type": "road_scene",
            "layout": {
                "x": 0,
                "y": 0,
                "w": 70,
                "h": 100
            },
            "content": {
                "background": "asphalt",
                "objects": [
                    {
                        "id": "road_v",
                        "component_id": "primitive_rect",
                        "transform": {
                            "x": 40,
                            "y": 0,
                            "rotation": 0,
                            "z_index": 0
                        },
                        "props": {
                            "width": 20,
                            "height": 100,
                            "fill": "#333"
                        }
                    },
                    {
                        "id": "road_h",
                        "component_id": "primitive_rect",
                        "transform": {
                            "x": 0,
                            "y": 40,
                            "rotation": 0,
                            "z_index": 0
                        },
                        "props": {
                            "width": 100,
                            "height": 20,
                            "fill": "#333"
                        }
                    },
                    {
                        "id": "car_a",
                        "component_id": "vehicle_sedan",
                        "transform": {
                            "x": 45,
                            "y": 80,
                            "rotation": 0,
                            "z_index": 10
                        },
                        "props": {
                            "color": "blue"
                        }
                    },
                    {
                        "id": "car_b",
                        "component_id": "vehicle_sedan",
                        "transform": {
                            "x": 10,
                            "y": 45,
                            "rotation": 90,
                            "z_index": 10
                        },
                        "props": {
                            "color": "red"
                        }
                    }
                ]
            }
        },
        {
            "id": "block_question",
            "type": "definition_card",
            "layout": {
                "x": 70,
                "y": 0,
                "w": 30,
                "h": 50
            },
            "content": {
                "title": "Question 1",
                "text": "In this situation, which vehicle must wait?"
            }
        },
        {
            "id": "block_speed",
            "type": "gauge",
            "layout": {
                "x": 70,
                "y": 50,
                "w": 30,
                "h": 50
            },
            "content": {
                "value": 50,
                "max": 120,
                "label": "Speed Limit"
            }
        }
    ]
}